{
  "schema_version": "1.0",
  "request_id": "xplat-007-us2-release-readiness",
  "helper_id": "release-readiness",
  "operation": "release-readiness",
  "mode": "read_only",
  "inputs": {
    "case_file": "tests/speckit-pro/layer4-scripts/fixtures/xplat-007-gates/release-readiness-cases.json",
    "case_id": "ready",
    "xplat_008_cutover_allowed": false
  }
}
