{
  "schema_version": "1.0",
  "request_id": "xplat-008-payload-completeness-current",
  "helper_id": "payload-gate",
  "operation": "payload-completeness",
  "mode": "read_only",
  "inputs": {
    "case_file": "tests/speckit-pro/layer4-scripts/fixtures/xplat-008-release/payload-completeness-cases.json",
    "case_id": "current-committed-dist"
  }
}
