{
  "schema_version": "1.0",
  "request_id": "fixture-estimate-reviewable-loc",
  "helper_id": "estimate-reviewable-loc",
  "operation": "estimate-reviewable-loc",
  "mode": "read_only",
  "inputs": {
    "plan_file": "tests/speckit-pro/layer4-scripts/fixtures/read-only-helpers/xplat-005-feature/plan.md"
  }
}
